{
  "$schema": "https://miri-whl.github.io/schemas/sdk-manifest-v1.json",
  "sdk_version": "1.1.0",
  "generated_at": "2026-09-20T00:00:00Z",
  "miri_version": "1.0",
  "quick_reference": {
    "primary_classes": [],
    "key_methods": [],
    "common_imports": [
      "import greetlib"
    ]
  },
  "api_index": {},
  "error_handling": {
    "TypeError": {
      "when": "a non-string name is passed",
      "common_causes": [
        "passing None"
      ],
      "solutions": [
        "pass a str"
      ]
    }
  }
}
